{
  "schemaVersion": "1.0.0",
  "operation": "SCAN",
  "outcome": "SUCCEEDED",
  "counts": { "detections": 1, "conflicts": 0, "byEntity": { "EMAIL": 1 } },
  "detections": [{
    "entityType": "EMAIL",
    "start": 8,
    "end": 25,
    "offsetUnit": "UNICODE_CODE_POINT",
    "confidence": 0.99,
    "sources": ["REGEX"]
  }],
  "detailsLimited": false
}
